COMMENT_ID,AUTHOR,DATE,CONTENT,CLASS
LneaDw26bFv4NFg1m91sL1Aq1p-2N06VweQT4vOwTqc,Ando Nesia - | MC | Music Producer,,DO YOU KNOW HOW SEAN KINGSTON GOT FAMOUS WHY DON&#39;T YOU LOOK IT UP KID BEFORE YOUR SO HARD ON YOURSELF!!  IF YOU HIT ME UP WITH A MESSAGE IN MY INBOX AND SUBSCRIBE I WILL CHECK OUT YOUR CHANNEL....SOUNDS FAIR TO ME.,1
z12wvru4rzf5jx0wj04cgx5q1qi1w554ba0,Erin Williams,2015-05-06T17:19:21.193000,Best. Song. EVER 🙌﻿,0
LneaDw26bFsVQRSG0ecctIfRIn4Od1tJqvnhDwCNqbI,the34104,,check out eminem latest track survival if u didnt,1
LneaDw26bFu3RCmyrWyP9S6wh1h9dBv3X95g1HzKAb4,Dany PK,,SUBSCRIBE TO MY CHANNEL X PLEASE!. SPARE,1
LneaDw26bFsD65dtIvAEObWYIYnFTqQDKBek_Ypz3J8,SmexyFriedChicken,,Check out my videos guy! :) Hope you guys had a good laugh :D,1
LneaDw26bFuvs-8oWkLpAFa6g3QHpWD8k7sbbMP3Bg8,The Guy That's Done Everything,,3 yrs ago I had a health scare but thankfully I’m okay. I realized I wasn’t living life to the fullest.  Now I’m on a mission to do EVERYTHING I’ve always wanted to do. If you found out you were going to die tomorrow would you be happy with what you’ve accomplished or would you regret not doing certain things? Sorry for spamming I’m just trying to motivate people to do the things they’ve always wanted to. If you’re bored come see what I’ve done so far! Almost 1000 subscribers and I just started!,1
z12hfp2wmyuqztkw504cgblyxtbsxjuzeow0k,Jesse Pinkman,2015-05-06T11:42:44.601000,Rihanna looks so beautiful with red hair ;)﻿,0
z13tsbc5vvn0hdozz04chjt51lq1cvris0k,Gaming Gaming,2015-05-06T10:56:35.972000,857.482.940 views AWESOME !!!!!!!!!!!!!!!!!!!!!!!!!!!!!!!!!!!!!!!!!!﻿,0
